ResponseId,MainBranch,Employment,RemoteWork,CodingActivities,EdLevel,LearnCode,LearnCodeOnline,LearnCodeCoursesCert,YearsCode,YearsCodePro,DevType,OrgSize,PurchaseInfluence,BuyNewTool,Country,Currency,CompTotal,CompFreq,LanguageHaveWorkedWith,LanguageWantToWorkWith,DatabaseHaveWorkedWith,DatabaseWantToWorkWith,PlatformHaveWorkedWith,PlatformWantToWorkWith,WebframeHaveWorkedWith,WebframeWantToWorkWith,MiscTechHaveWorkedWith,MiscTechWantToWorkWith,ToolsTechHaveWorkedWith,ToolsTechWantToWorkWith,NEWCollabToolsHaveWorkedWith,NEWCollabToolsWantToWorkWith,OpSysProfessional use,OpSysPersonal use,VersionControlSystem,VCInteraction,VCHostingPersonal use,VCHostingProfessional use,OfficeStackAsyncHaveWorkedWith,OfficeStackAsyncWantToWorkWith,OfficeStackSyncHaveWorkedWith,OfficeStackSyncWantToWorkWith,Blockchain,NEWSOSites,SOVisitFreq,SOAccount,SOPartFreq,SOComm,Age,Gender,Trans,Sexuality,Ethnicity,Accessibility,MentalHealth,TBranch,ICorPM,WorkExp,Knowledge_1,Knowledge_2,Knowledge_3,Knowledge_4,Knowledge_5,Knowledge_6,Knowledge_7,Frequency_1,Frequency_2,Frequency_3,TimeSearching,TimeAnswering,Onboarding,ProfessionalTech,TrueFalse_1,TrueFalse_2,TrueFalse_3,SurveyLength,SurveyEase,ConvertedCompYearly
4719, I am a developer by profession, Independent contractor, freelancer, or self-employed, Fully remote, Hobby;Contribute to open-source projects, Bachelor’s degree (B.A., B.S., B.Eng., etc.), Books / Physical media;Other online resources (e.g., videos, blogs, forum);Online Courses or Certification, Technical documentation;Blogs;Online books;Video-based Online Courses;How-to videos;Written-based Online Courses;Coding sessions (live or recorded), Udemy;Pluralsight, 19, 17, Developer, back-end;Database administrator;Project manager;Cloud infrastructure engineer;Product manager, 2 to 9 employees, I have a great deal of influence, Other (please specify):;Start a free trial;Visit developer communities like Stack Overflow, Zimbabwe, USD	United States dollar, NA, NA, Rust, Rust, NA, NA, Linode, Linode, NA, NA, NA, NA, NA, NA, Vim, Vim, Linux-based, Linux-based, Git, Command-line, , , NA, NA, NA, NA, Very favorable, Stack Overflow;Stack Exchange, A few times per month or weekly, Yes, I have never participated in Q&A on Stack Overflow, No, not really, 35-44 years old, Man, No, Straight / Heterosexual, African;Black, None of the above, None of the above, No, NA, NA, NA, NA, NA, NA, NA, NA, NA, NA, NA, NA, NA, NA, NA, NA, NA, NA, NA, Too long, Easy, NA, 
19594, I am a developer by profession, Not employed, and not looking for work, NA, NA, Secondary school (e.g. American high school, German Realschule or Gymnasium, etc.), Other online resources (e.g., videos, blogs, forum);School (i.e., University, College, etc);Online Courses or Certification, Programming Games;Stack Overflow;Video-based Online Courses;Online challenges (e.g., daily or weekly coding challenges), Pluralsight, 4, NA, NA, NA, NA, Start a free trial;Visit developer communities like Stack Overflow;Ask developers I know/work with, Zimbabwe, NA, NA, NA, Kotlin, Dart, Firebase Realtime Database, Cloud Firestore, Firebase, Firebase, NA, NA, NA, NA, NA, NA, PyCharm, PyCharm, Windows, Windows, I don't use one, NA, , , NA, NA, Microsoft Teams, NA, Unsure, Stack Overflow;Stack Exchange, A few times per week, Yes, A few times per month or weekly, Neutral, Under 18 years old, Or, in your own words:, No, NA, Prefer not to say, None of the above, None of the above, NA, NA, NA, NA, NA, NA, NA, NA, NA, NA, NA, NA, NA, NA, NA, NA, NA, NA, NA, NA, Appropriate in length, Easy, NA, 
24120, I code primarily as a hobby, Student, full-time, NA, NA, Some college/university study without earning a degree, Friend or family member;Other online resources (e.g., videos, blogs, forum);School (i.e., University, College, etc), Online books;How-to videos, NA, 3, NA, NA, NA, NA, Start a free trial;Visit developer communities like Stack Overflow, Zimbabwe, NA, NA, NA, Assembly;C;Java;JavaScript;Python;TypeScript, Dart;Lua;Rust, PostgreSQL;SQLite, MongoDB, AWS, DigitalOcean;Firebase, Flask;React.js, Next.js;Svelte, Capacitor;Electron;Ionic;React Native, Flutter, npm, NA, Android Studio;Vim;Visual Studio Code, NA, Windows Subsystem for Linux (WSL), Windows Subsystem for Linux (WSL), Git, Command-line, , , NA, NA, NA, NA, Indifferent, Stack Overflow, A few times per month or weekly, Yes, I have never participated in Q&A on Stack Overflow, Neutral, 18-24 years old, Man, No, Straight / Heterosexual, African, None of the above, NA, NA, NA, NA, NA, NA, NA, NA, NA, NA, NA, NA, NA, NA, NA, NA, NA, NA, NA, NA, NA, Appropriate in length, NA, NA, 
25819, I am learning to code, Student, full-time, NA, NA, Secondary school (e.g. American high school, German Realschule or Gymnasium, etc.), Books / Physical media;Other online resources (e.g., videos, blogs, forum), Technical documentation;Blogs;Written Tutorials;Stack Overflow;Online books;Online forum;How-to videos;Interactive tutorial;Coding sessions (live or recorded), NA, Less than 1 year, NA, NA, NA, NA, Start a free trial;Read ratings or reviews on third party sites like G2Crowd, Zimbabwe, NA, NA, NA, C#, Python, NA, NA, NA, NA, NA, NA, NA, NA, Unity 3D, NA, Visual Studio Code, IPython/Jupyter;Visual Studio Code, , Windows, I don't use one, NA, , , NA, NA, NA, NA, Indifferent, Stack Overflow, Multiple times per day, Yes, A few times per week, Yes, somewhat, 18-24 years old, Man, No, Straight / Heterosexual, African;Black, None of the above, None of the above, NA, NA, NA, NA, NA, NA, NA, NA, NA, NA, NA, NA, NA, NA, NA, NA, NA, NA, NA, NA, Appropriate in length, Easy, NA, 
25845, I code primarily as a hobby, Employed, full-time, Hybrid (some remote, some in-person), Bootstrapping a business;Freelance/contract work, Bachelor’s degree (B.A., B.S., B.Eng., etc.), Books / Physical media;Other online resources (e.g., videos, blogs, forum);Online Courses or Certification, Technical documentation;Blogs;Online books;Video-based Online Courses;How-to videos, Udemy, 5, NA, Engineer, site reliability, NA, NA, Start a free trial, Zimbabwe, NA, NA, NA, Elixir, Elixir, PostgreSQL, PostgreSQL, Heroku, AWS, Phoenix, Phoenix, NA, NA, Docker, NA, Vim, Vim, macOS, macOS, Git, Code editor;Command-line, , , Notion, ClickUp, Slack, Slack, Unsure, Stack Overflow;Stack Exchange, A few times per month or weekly, Yes, I have never participated in Q&A on Stack Overflow, Neutral, 35-44 years old, Man, No, Straight / Heterosexual, Black, None of the above, None of the above, Yes, People manager, 10, Strongly disagree, Neither agree nor disagree, Neither agree nor disagree, Agree, Agree, Disagree, Neither agree nor disagree, 1-2 times a week, 1-2 times a week, 1-2 times a week, 30-60 minutes a day, 30-60 minutes a day, Somewhat long, DevOps function;Microservices;Continuous integration (CI) and (more often) continuous delivery;Observability tools, Yes, Yes, Yes, Too long, Easy, NA, 
27470, I am a developer by profession, Employed, full-time;Student, part-time;Employed, part-time, Hybrid (some remote, some in-person), Hobby;Freelance/contract work;School or academic work, Bachelor’s degree (B.A., B.S., B.Eng., etc.), Books / Physical media;Friend or family member;Other online resources (e.g., videos, blogs, forum);School (i.e., University, College, etc);Online Courses or Certification;Colleague, Technical documentation;Blogs;Stack Overflow;Video-based Online Courses, Udemy;Pluralsight, 5, NA, Developer, front-end;Developer, full-stack, NA, NA, NA, Zimbabwe, NA, NA, NA, Dart;HTML/CSS;Java;JavaScript;PHP;SQL;TypeScript, Dart;HTML/CSS;Java;JavaScript;Kotlin;PHP;SQL;TypeScript, MariaDB;Microsoft SQL Server;MongoDB;MySQL;PostgreSQL, MariaDB;Microsoft SQL Server;MongoDB;MySQL;PostgreSQL, DigitalOcean;Heroku, DigitalOcean, Angular;Express;Laravel;Vue.js, Angular;Express;Laravel;React.js;Vue.js, Capacitor;Spring, Spring, Docker;Homebrew;npm, Docker;Homebrew;Kubernetes;npm, Android Studio;IntelliJ;PhpStorm;Visual Studio Code;Webstorm, Android Studio;IntelliJ;PhpStorm;Visual Studio Code;Webstorm, Linux-based;macOS;Windows;Windows Subsystem for Linux (WSL), Linux-based;macOS;Windows;Windows Subsystem for Linux (WSL), Git, Code editor;Command-line, , , Jira Work Management, Jira Work Management, Google Chat;Microsoft Teams;Zoom, Google Chat;Microsoft Teams;Zoom, Favorable, Stack Overflow;Stack Exchange, A few times per month or weekly, Yes, I have never participated in Q&A on Stack Overflow, Yes, somewhat, 18-24 years old, Man, No, Straight / Heterosexual, African;Black, None of the above, None of the above, Yes, Independent contributor, 4, Agree, Neither agree nor disagree, Disagree, Neither agree nor disagree, Disagree, Agree, Agree, 1-2 times a week, 1-2 times a week, 1-2 times a week, 15-30 minutes a day, Less than 15 minutes a day, Very long, Microservices, No, Yes, Yes, Too long, Neither easy nor difficult, NA, 
30291, I am a developer by profession, Employed, full-time, Full in-person, Freelance/contract work, Master’s degree (M.A., M.S., M.Eng., MBA, etc.), Books / Physical media;Other online resources (e.g., videos, blogs, forum);On the job training, Written Tutorials;Stack Overflow;Video-based Online Courses;How-to videos;Written-based Online Courses;Coding sessions (live or recorded), NA, 3, 5, Developer, full-stack;Developer, back-end;Developer, desktop or enterprise applications;Developer, mobile, 10 to 19 employees, I have a great deal of influence, Visit developer communities like Stack Overflow;Ask developers I know/work with, Zimbabwe, USD	United States dollar, 1000, Monthly, HTML/CSS;Java;JavaScript;PHP;SQL;VBA, HTML/CSS;Java;JavaScript;Kotlin;SQL, MySQL;Firebase Realtime Database;SQLite, MySQL;SQLite, Google Cloud;Managed Hosting;VMware, AWS;Google Cloud, Drupal;Flask;React.js, NA, React Native;Spring, Spring, npm, Docker;Kubernetes;Unity 3D;Unreal Engine, Android Studio;IntelliJ;Notepad++;Sublime Text;Visual Studio;Visual Studio Code, Android Studio;IntelliJ;Notepad++;Sublime Text, Windows, Windows, Git, Dedicated version control GUI application, , , Trello, Trello, Google Chat;Microsoft Teams;Slack;Zoom, Slack;Zoom, Unsure, Stack Overflow, Multiple times per day, Yes, Less than once per month or monthly, Yes, definitely, 25-34 years old, Man, No, Straight / Heterosexual, African, None of the above, I have learning differences (e.g., Dyslexic, Dyslexia, etc.), Yes, Independent contributor, 4, Agree, Disagree, Agree, Agree, Disagree, Agree, Disagree, 1-2 times a week, 10+ times a week, 1-2 times a week, Over 120 minutes a day, 15-30 minutes a day, Somewhat long, DevOps function;Observability tools, Yes, No, Yes, Too long, Easy, 12000, 
30391, I am learning to code, Student, full-time;Independent contractor, freelancer, or self-employed, Hybrid (some remote, some in-person), Hobby;Contribute to open-source projects;Freelance/contract work;School or academic work, Some college/university study without earning a degree, Other online resources (e.g., videos, blogs, forum);School (i.e., University, College, etc);Hackathons (virtual or in-person), Technical documentation;Blogs;Programming Games;Stack Overflow;Video-based Online Courses;Online forum;How-to videos;Written-based Online Courses;Coding sessions (live or recorded);Certification videos, NA, 9, NA, Developer, front-end;Developer, full-stack;Developer, back-end;Developer, desktop or enterprise applications;Student;Developer, mobile, NA, NA, Visit developer communities like Stack Overflow;Research companies that have advertised on sites I visit;Read ratings or reviews on third party sites like G2Crowd, Zimbabwe, NA, NA, NA, C;C#;C++;HTML/CSS;Java;JavaScript;Kotlin;PHP;Python;SQL;TypeScript, Dart, MariaDB;Microsoft SQL Server;MongoDB;MySQL;Firebase Realtime Database, NA, Firebase;Google Cloud;Managed Hosting, AWS;Microsoft Azure, ASP.NET;Drupal;Next.js;Node.js;React.js;Vue.js, Angular;Angular.js;Vue.js, .NET, Flutter;React Native, npm;Yarn, Docker;Unity 3D, Android Studio;Atom;Eclipse;IntelliJ;NetBeans;Notepad++;PyCharm;RStudio;Sublime Text;Visual Studio;Visual Studio Code, RStudio, Windows, Windows, Git, Code editor;Command-line;Version control hosting service web GUI;Dedicated version control GUI application, , , Microsoft Planner;Microsoft Lists;Trello, NA, Microsoft Teams;Slack;Zoom, Microsoft Teams;Slack;Zoom, Unfavorable, Stack Overflow;Stack Exchange, A few times per month or weekly, Yes, Less than once per month or monthly, Yes, somewhat, 18-24 years old, Man, No, Straight / Heterosexual, African;Black, None of the above, None of the above, NA, NA, NA, NA, NA, NA, NA, NA, NA, NA, NA, NA, NA, NA, NA, NA, NA, NA, NA, NA, Appropriate in length, Neither easy nor difficult, NA, 
31003, I am a developer by profession, Employed, full-time, Hybrid (some remote, some in-person), Hobby;Contribute to open-source projects;Freelance/contract work, Bachelor’s degree (B.A., B.S., B.Eng., etc.), Other online resources (e.g., videos, blogs, forum);School (i.e., University, College, etc);On the job training;Online Courses or Certification, Technical documentation;Blogs;Written Tutorials;Stack Overflow;Video-based Online Courses;How-to videos;Interactive tutorial;Coding sessions (live or recorded);Certification videos, Udemy;Other, 4, 3, Developer, full-stack;Developer, back-end, 500 to 999 employees, I have little or no influence, Start a free trial;Visit developer communities like Stack Overflow;Ask developers I know/work with, Zimbabwe, USD	United States dollar, 600, Monthly, Java, Dart;Java;JavaScript;Python;Scala, MariaDB;MySQL;PostgreSQL;Redis, Cassandra;Elasticsearch;MariaDB;MongoDB;MySQL;Oracle;PostgreSQL;Redis, NA, NA, Django, Angular;Angular.js;Django;FastAPI;Flask;React.js, Spring, Apache Kafka;Apache Spark;Flutter;Hadoop;Spring, Docker;Kubernetes, Ansible;Docker;Kubernetes;Terraform, IntelliJ;PyCharm;Sublime Text;Webstorm, Android Studio;IntelliJ;PyCharm;Sublime Text;Webstorm, Linux-based, Linux-based, Git, Code editor;Command-line, , , Jira Work Management;Microsoft Planner, Confluence;Jira Work Management;Microsoft Planner;Trello, Microsoft Teams, Microsoft Teams;Slack;Zoom, Indifferent, Stack Overflow, Daily or almost daily, Yes, A few times per week, Yes, definitely, 25-34 years old, Man, No, Straight / Heterosexual, African, None of the above, None of the above, Yes, Independent contributor, 3, Agree, Agree, Neither agree nor disagree, Agree, Agree, Neither agree nor disagree, Neither agree nor disagree, 1-2 times a week, 1-2 times a week, 1-2 times a week, 30-60 minutes a day, 30-60 minutes a day, Very long, DevOps function, No, Yes, Yes, Too long, Neither easy nor difficult, 7200, 
35586, I am learning to code, Employed, part-time, Hybrid (some remote, some in-person), School or academic work, Some college/university study without earning a degree, On the job training, NA, NA, 1, NA, Developer, full-stack, NA, NA, Research companies that have emailed me, Zimbabwe, NA, NA, NA, Java;Python;Swift, HTML/CSS;JavaScript;Kotlin;Solidity, MySQL;PostgreSQL, SQLite, Google Cloud;IBM Cloud or Watson;Microsoft Azure;OpenStack, DigitalOcean;Managed Hosting, NA, NA, .NET;Apache Kafka;Capacitor;Flutter;GTK;Hadoop;React Native;Spring;TensorFlow;Uno Platform, Cordova;Electron;Ionic;NumPy;Qt;Scikit-learn, Docker;Flow, Pulumi;Puppet;Unreal Engine, Android Studio;Atom;Eclipse;IntelliJ;NetBeans;PhpStorm;PyCharm;Visual Studio;Visual Studio Code, Xcode, Linux-based;macOS, Windows, Git, Version control hosting service web GUI, , , NA, NA, Zoom, NA, Indifferent, Stack Overflow, Multiple times per day, Yes, I have never participated in Q&A on Stack Overflow, Yes, definitely, 18-24 years old, Man, No, Straight / Heterosexual, African, None of the above, None of the above, NA, NA, NA, NA, NA, NA, NA, NA, NA, NA, NA, NA, NA, NA, NA, NA, NA, NA, NA, NA, Too long, Easy, NA, 
36078, I am a developer by profession, Employed, full-time, Hybrid (some remote, some in-person), Hobby;Contribute to open-source projects;Bootstrapping a business;Freelance/contract work, Some college/university study without earning a degree, Books / Physical media;Other online resources (e.g., videos, blogs, forum);On the job training;Online Courses or Certification, Technical documentation;Blogs;Written Tutorials;Stack Overflow;Video-based Online Courses;Certification videos, Udacity, 6, 4, Data scientist or machine learning specialist;Developer, front-end;Engineer, data;Developer, full-stack;Developer, back-end;Developer, desktop or enterprise applications;Designer, 1,000 to 4,999 employees, I have some influence, Visit developer communities like Stack Overflow;Ask developers I know/work with, Zimbabwe, ZAR	South African rand, 750000, Monthly, HTML/CSS;MATLAB;Python;SQL, Dart;Python;SQL, Microsoft SQL Server;MongoDB;MySQL;PostgreSQL;SQLite, Microsoft SQL Server;MongoDB;MySQL;PostgreSQL;Redis;SQLite, NA, NA, FastAPI;Flask, FastAPI;Flask, Keras;NumPy;Pandas;Scikit-learn;TensorFlow, Keras;NumPy;Pandas;Scikit-learn;TensorFlow, NA, NA, IPython/Jupyter;Visual Studio Code, IPython/Jupyter;Visual Studio Code, Linux-based;Windows;Windows Subsystem for Linux (WSL), Windows, Git, Code editor;Command-line;Version control hosting service web GUI, , , NA, NA, Microsoft Teams;Slack;Zoom, Microsoft Teams, Indifferent, Stack Overflow;Stack Exchange, Daily or almost daily, Yes, A few times per month or weekly, Yes, somewhat, 25-34 years old, Man, No, Straight / Heterosexual, African, None of the above, NA, Yes, Independent contributor, 3, Agree, Agree, Agree, Agree, Agree, Agree, Disagree, 1-2 times a week, 3-5 times a week, 1-2 times a week, 15-30 minutes a day, 15-30 minutes a day, Very long, DevOps function;Observability tools, No, No, No, Appropriate in length, Neither easy nor difficult, 568968, 
38746, I am learning to code, Student, part-time, NA, NA, Secondary school (e.g. American high school, German Realschule or Gymnasium, etc.), Other online resources (e.g., videos, blogs, forum);School (i.e., University, College, etc);Online Courses or Certification, Video-based Online Courses;Online forum;How-to videos;Written-based Online Courses, Udemy;Codecademy;edX, 1, NA, NA, NA, NA, Visit developer communities like Stack Overflow, Zimbabwe, NA, NA, NA, C;HTML/CSS;JavaScript, C;C#;C++;HTML/CSS;JavaScript;Python;SQL, NA, NA, NA, NA, NA, NA, NA, NA, NA, NA, Visual Studio Code, Visual Studio Code, , Linux-based;Windows Subsystem for Linux (WSL), I don't use one, NA, , , NA, NA, Zoom, Zoom, Very unfavorable, Stack Overflow, Less than once per month or monthly, No, NA, No, not at all, 18-24 years old, Prefer not to say, Prefer not to say, Prefer not to say, Prefer not to say, None of the above, None of the above, NA, NA, NA, NA, NA, NA, NA, NA, NA, NA, NA, NA, NA, NA, NA, NA, NA, NA, NA, NA, Too long, Neither easy nor difficult, NA, 
42449, I am learning to code, Student, part-time, NA, NA, Some college/university study without earning a degree, Books / Physical media;School (i.e., University, College, etc);On the job training, NA, NA, 2, NA, NA, NA, NA, Start a free trial;Visit developer communities like Stack Overflow, Zimbabwe, NA, NA, NA, C;HTML/CSS;Java;JavaScript;PHP, C++;PHP;SQL, MySQL, MariaDB;Microsoft SQL Server;Oracle;PostgreSQL;Firebase Realtime Database, NA, NA, jQuery;Laravel;Vue.js, Vue.js, Spring, Spring, npm, npm, Atom;Eclipse;IntelliJ;NetBeans;Notepad++;PhpStorm;Sublime Text;Visual Studio Code, Eclipse;IntelliJ;NetBeans;Notepad++;PhpStorm, Linux-based, Windows, Git, Code editor;Command-line;Version control hosting service web GUI, , , NA, NA, Microsoft Teams;Zoom, Microsoft Teams;Zoom, Unsure, Stack Overflow, Daily or almost daily, Yes, I have never participated in Q&A on Stack Overflow, Neutral, 18-24 years old, Man, No, Straight / Heterosexual, African, None of the above, Prefer not to say, NA, NA, NA, NA, NA, NA, NA, NA, NA, NA, NA, NA, NA, NA, NA, NA, NA, NA, NA, NA, Appropriate in length, Neither easy nor difficult, NA, 
43528, I am a developer by profession, Independent contractor, freelancer, or self-employed, Fully remote, Freelance/contract work, Bachelor’s degree (B.A., B.S., B.Eng., etc.), Books / Physical media;School (i.e., University, College, etc);On the job training;Online Courses or Certification, NA, Pluralsight, 14, 8, Developer, back-end, 500 to 999 employees, I have little or no influence, Start a free trial;Visit developer communities like Stack Overflow;Ask developers I know/work with, Zimbabwe, USD	United States dollar, NA, Monthly, Java;SQL, Java;SQL, DynamoDB;MongoDB;MySQL;Oracle, DynamoDB;Oracle, AWS, AWS, NA, NA, Spring, Spring, Docker;Puppet, Docker;Puppet, IntelliJ;Vim;Visual Studio Code, IntelliJ;Vim, Linux-based;macOS, Linux-based;macOS, Git, Command-line;Dedicated version control GUI application, , , Confluence;Jira Work Management, Confluence;Jira Work Management, Google Chat;Microsoft Teams;Zoom, Microsoft Teams, Indifferent, Stack Overflow;Stack Exchange, Daily or almost daily, Yes, A few times per month or weekly, Yes, somewhat, 35-44 years old, Man, No, Straight / Heterosexual, African, None of the above, None of the above, Yes, Independent contributor, 11, Neither agree nor disagree, Disagree, Strongly agree, Strongly agree, Strongly agree, Disagree, Disagree, Never, Never, Never, 30-60 minutes a day, 15-30 minutes a day, Somewhat long, Microservices;Developer portal or other central places to find tools/services;Continuous integration (CI) and (more often) continuous delivery;Automated testing;Observability tools, No, Yes, Yes, Too long, Neither easy nor difficult, NA, 
44536, I am a developer by profession, Employed, full-time, Full in-person, Hobby;Contribute to open-source projects;Bootstrapping a business;Freelance/contract work;School or academic work, Some college/university study without earning a degree, Books / Physical media;Other online resources (e.g., videos, blogs, forum);School (i.e., University, College, etc);Online Courses or Certification;Coding Bootcamp;Hackathons (virtual or in-person), Technical documentation;Blogs;Written Tutorials;Stack Overflow;Online books;Video-based Online Courses;Online challenges (e.g., daily or weekly coding challenges);How-to videos;Written-based Online Courses;Interactive tutorial;Coding sessions (live or recorded), Coursera;Udemy;edX, 4, 2, Developer, full-stack;Educator, 2 to 9 employees, I have a great deal of influence, Visit developer communities like Stack Overflow;Ask developers I know/work with;Research companies that have advertised on sites I visit, Zimbabwe, USD	United States dollar, 300, Monthly, Bash/Shell;C++;HTML/CSS;Java;JavaScript;Python;VBA, Bash/Shell;Dart;Go;HTML/CSS;Java;JavaScript;Kotlin;Python;Scala;Solidity;TypeScript, Cloud Firestore;Microsoft SQL Server;MongoDB;MySQL;PostgreSQL;Firebase Realtime Database;SQLite, Cloud Firestore;MongoDB;MySQL;PostgreSQL;Firebase Realtime Database, Firebase;Google Cloud;Heroku, AWS;DigitalOcean;Firebase;Google Cloud;Heroku;Linode;Microsoft Azure, Django;Express;Node.js;React.js, Django;Express;FastAPI;Next.js;Node.js;React.js;Vue.js, .NET, NumPy;React Native;Scikit-learn;Spring;TensorFlow, npm, Docker;npm, Android Studio;Atom;Nano;PyCharm;Spyder;Sublime Text;Visual Studio;Visual Studio Code, Android Studio;Atom;IPython/Jupyter;PyCharm;Spyder;Vim;Visual Studio Code, Windows, , Git, Code editor;Command-line, , , ClickUp;Notion, ClickUp;Jira Work Management;Microsoft Planner;Microsoft Lists;Notion;Trello, Google Chat;Zoom, Google Chat;Microsoft Teams;Zoom, Very favorable, Stack Overflow;Stack Exchange, Daily or almost daily, Yes, I have never participated in Q&A on Stack Overflow, No, not really, 25-34 years old, Man, No, Straight / Heterosexual, African;Black, None of the above, None of the above, Yes, Independent contributor, 2, Strongly agree, Disagree, Agree, Agree, Agree, Agree, Neither agree nor disagree, 1-2 times a week, 1-2 times a week, 1-2 times a week, 60-120 minutes a day, 15-30 minutes a day, Very short, Continuous integration (CI) and (more often) continuous delivery, No, Yes, Yes, Appropriate in length, Easy, 3600, 
