ResponseId,MainBranch,Employment,RemoteWork,CodingActivities,EdLevel,LearnCode,LearnCodeOnline,LearnCodeCoursesCert,YearsCode,YearsCodePro,DevType,OrgSize,PurchaseInfluence,BuyNewTool,Country,Currency,CompTotal,CompFreq,LanguageHaveWorkedWith,LanguageWantToWorkWith,DatabaseHaveWorkedWith,DatabaseWantToWorkWith,PlatformHaveWorkedWith,PlatformWantToWorkWith,WebframeHaveWorkedWith,WebframeWantToWorkWith,MiscTechHaveWorkedWith,MiscTechWantToWorkWith,ToolsTechHaveWorkedWith,ToolsTechWantToWorkWith,NEWCollabToolsHaveWorkedWith,NEWCollabToolsWantToWorkWith,OpSysProfessional use,OpSysPersonal use,VersionControlSystem,VCInteraction,VCHostingPersonal use,VCHostingProfessional use,OfficeStackAsyncHaveWorkedWith,OfficeStackAsyncWantToWorkWith,OfficeStackSyncHaveWorkedWith,OfficeStackSyncWantToWorkWith,Blockchain,NEWSOSites,SOVisitFreq,SOAccount,SOPartFreq,SOComm,Age,Gender,Trans,Sexuality,Ethnicity,Accessibility,MentalHealth,TBranch,ICorPM,WorkExp,Knowledge_1,Knowledge_2,Knowledge_3,Knowledge_4,Knowledge_5,Knowledge_6,Knowledge_7,Frequency_1,Frequency_2,Frequency_3,TimeSearching,TimeAnswering,Onboarding,ProfessionalTech,TrueFalse_1,TrueFalse_2,TrueFalse_3,SurveyLength,SurveyEase,ConvertedCompYearly
14222, I am a developer by profession, Employed, part-time, Hybrid (some remote, some in-person), Hobby;Contribute to open-source projects;Freelance/contract work;School or academic work, Bachelor’s degree (B.A., B.S., B.Eng., etc.), Books / Physical media;Friend or family member;Other online resources (e.g., videos, blogs, forum);Online Courses or Certification;Colleague, Technical documentation;Blogs;Stack Overflow;Online books;How-to videos, Udemy;Udacity, 23, 20, Data scientist or machine learning specialist;Developer, front-end;Developer, full-stack;Developer, back-end, 10 to 19 employees, I have some influence, Ask developers I know/work with, Bhutan, BTN	Bhutanese ngultrum, NA, Yearly, C++;HTML/CSS;JavaScript;Python;Ruby;Swift, Elixir;Python;Ruby;Rust, PostgreSQL;Redis;SQLite, CouchDB, AWS;DigitalOcean;Firebase;Heroku, Heroku, Django;Flask;Ruby on Rails;Vue.js, Phoenix;Ruby on Rails, React Native, NA, Docker;Homebrew;npm;Yarn, Docker;Homebrew, IPython/Jupyter;RubyMine;TextMate;Vim, IPython/Jupyter;Neovim;TextMate;Vim, Linux-based;macOS, Linux-based;macOS, Git, Command-line;Version control hosting service web GUI, , , NA, NA, Slack;Zoom, NA, Very unfavorable, Stack Overflow, Daily or almost daily, No, NA, No, not at all, 35-44 years old, Non-binary, genderqueer, or gender non-conforming, Prefer not to say, Queer, European, I am unable to / find it difficult to type, Prefer not to say, No, NA, NA, NA, NA, NA, NA, NA, NA, NA, NA, NA, NA, NA, NA, NA, NA, NA, NA, NA, Appropriate in length, Difficult, NA, 
29187, I code primarily as a hobby, Employed, full-time, Hybrid (some remote, some in-person), Hobby;Freelance/contract work, Some college/university study without earning a degree, Friend or family member;Other online resources (e.g., videos, blogs, forum);School (i.e., University, College, etc);On the job training;Online Courses or Certification;Colleague;Hackathons (virtual or in-person), Technical documentation;Blogs;Written Tutorials;Stack Overflow;Online books;Video-based Online Courses;Online forum;How-to videos;Written-based Online Courses;Auditory material (e.g., podcasts);Interactive tutorial;Coding sessions (live or recorded);Certification videos, Coursera;Udemy;Codecademy;edX, 6, NA, Engineer, site reliability;Database administrator;DevOps specialist;Cloud infrastructure engineer;System administrator, NA, NA, Start a free trial;Visit developer communities like Stack Overflow;Ask developers I know/work with;Research companies that have advertised on sites I visit;Read ratings or reviews on third party sites like G2Crowd;Research companies that have emailed me, Bhutan, NA, NA, NA, Go;HTML/CSS;Lua;Ruby;Rust;SQL, Erlang;HTML/CSS;JavaScript;Kotlin;Lua;Ruby;Rust;SQL, Elasticsearch;MongoDB;MySQL;PostgreSQL;Redis;SQLite, Elasticsearch;MongoDB;MySQL;PostgreSQL;Redis;SQLite, AWS;DigitalOcean;Google Cloud;Microsoft Azure;Oracle Cloud Infrastructure, AWS;DigitalOcean;Google Cloud;Heroku;Linode;Microsoft Azure;Oracle Cloud Infrastructure;OpenStack;OVH, Ruby on Rails, Django;Express;FastAPI;Fastify;Flask;Node.js;Ruby on Rails, NA, NA, Ansible;Docker;Kubernetes;Terraform, Ansible;Chef;Docker;Homebrew;Kubernetes;Terraform, PyCharm;Vim;Visual Studio, IntelliJ;PyCharm;Vim;Visual Studio, Linux-based;macOS;Windows;Windows Subsystem for Linux (WSL), Linux-based;macOS;Windows;Windows Subsystem for Linux (WSL), Git, Command-line;Version control hosting service web GUI, , , ClickUp;Trello, ClickUp;Trello, Google Chat;Mattermost;Microsoft Teams;Slack;Zoom, Google Chat;Mattermost;Microsoft Teams;Slack;Zoom, Favorable, Collectives on Stack Overflow;Stack Overflow for Teams (private knowledge sharing & collaboration platform for companies);Stack Overflow;Stack Exchange, Daily or almost daily, Yes, A few times per month or weekly, Yes, definitely, 25-34 years old, Man, No, Straight / Heterosexual, Asian;East Asian, None of the above, None of the above, Yes, People manager, 3, Strongly disagree, Disagree, Disagree, Disagree, Strongly disagree, Neither agree nor disagree, Neither agree nor disagree, Never, 3-5 times a week, 6-10 times a week, 30-60 minutes a day, 30-60 minutes a day, Somewhat long, Innersource initiative;DevOps function;Microservices;Developer portal or other central places to find tools/services;Continuous integration (CI) and (more often) continuous delivery;Automated testing, Yes, Yes, Yes, Too long, Neither easy nor difficult, NA, 
32081, I am not primarily a developer, but I write code sometimes as part of my work, Employed, full-time, Full in-person, Hobby, Bachelor’s degree (B.A., B.S., B.Eng., etc.), Other online resources (e.g., videos, blogs, forum);School (i.e., University, College, etc);Online Courses or Certification, Technical documentation;Blogs;Written Tutorials;Online books;Video-based Online Courses;Online challenges (e.g., daily or weekly coding challenges);How-to videos;Written-based Online Courses;Interactive tutorial;Coding sessions (live or recorded);Certification videos, Coursera;Other, 8, 4, Data or business analyst, 20 to 99 employees, I have some influence, Visit developer communities like Stack Overflow;Read ratings or reviews on third party sites like G2Crowd, Bhutan, BTN	Bhutanese ngultrum, 700000, Yearly, Python, Python;R, MariaDB;MySQL, MariaDB;Microsoft SQL Server;MySQL;Oracle;PostgreSQL, NA, NA, NA, NA, Pandas, NumPy;Pandas, NA, NA, Sublime Text;Visual Studio Code, Visual Studio Code, Windows, Windows, Git, Command-line, , , Microsoft Planner, Asana;Confluence;Jira Work Management;Trello, Microsoft Teams, Slack, Unfavorable, Stack Overflow;Stack Exchange, Less than once per month or monthly, Yes, Less than once per month or monthly, Yes, somewhat, 25-34 years old, Man, No, Straight / Heterosexual, South Asian, None of the above, None of the above, Yes, Independent contributor, 4, Agree, Agree, Agree, Agree, Agree, Strongly agree, Agree, 1-2 times a week, 1-2 times a week, 1-2 times a week, 60-120 minutes a day, 15-30 minutes a day, Somewhat long, None of these, Yes, No, No, Appropriate in length, Easy, 9028, 
32355, I am a developer by profession, Employed, full-time, Full in-person, Contribute to open-source projects;Freelance/contract work, Bachelor’s degree (B.A., B.S., B.Eng., etc.), Other online resources (e.g., videos, blogs, forum);Online Courses or Certification;Coding Bootcamp, Technical documentation;Blogs;Written Tutorials;Stack Overflow;Online books;Video-based Online Courses;Online forum;How-to videos;Written-based Online Courses;Interactive tutorial;Coding sessions (live or recorded);Certification videos, Coursera;Udemy;Udacity, 9, 8, Developer, front-end;Developer, full-stack;Developer, back-end;Developer, mobile;Database administrator;DevOps specialist;Senior Executive (C-Suite, VP, etc.);Blockchain, 10 to 19 employees, I have a great deal of influence, Start a free trial;Visit developer communities like Stack Overflow;Research companies that have advertised on sites I visit;Read ratings or reviews on third party sites like G2Crowd;Research companies that have emailed me, Bhutan, BTN	Bhutanese ngultrum, 50000, Monthly, Ruby, NA, Elasticsearch;PostgreSQL;Redis;SQLite, NA, AWS;DigitalOcean;Firebase;Heroku, NA, Angular;Angular.js;ASP.NET;FastAPI;Gatsby;jQuery;Laravel;Node.js;React.js;Ruby on Rails, NA, .NET;Electron;React Native;Spring, NA, Docker;Homebrew;npm;Yarn, NA, Android Studio;Eclipse;IntelliJ;NetBeans;Notepad++;PhpStorm;PyCharm;RubyMine;Sublime Text;TextMate;Vim;Visual Studio;Visual Studio Code;Webstorm;Xcode, NA, , BSD;Linux-based;macOS;Windows;Windows Subsystem for Linux (WSL), Git;SVN, Code editor;Command-line;Version control hosting service web GUI, , , Jira Work Management;monday.com;Trello, NA, Cisco Webex Teams;Google Chat;Slack;Zoom, NA, Very unfavorable, Collectives on Stack Overflow;Stack Overflow;Stack Exchange, Daily or almost daily, Yes, Less than once per month or monthly, Yes, definitely, 25-34 years old, Man, No, Straight / Heterosexual, Asian;East Asian, None of the above, NA, Yes, Independent contributor, 8, Strongly disagree, Agree, Agree, Disagree, Neither agree nor disagree, Disagree, Disagree, Never, Never, Never, 30-60 minutes a day, 30-60 minutes a day, Just right, DevOps function;Microservices;Developer portal or other central places to find tools/services;Continuous integration (CI) and (more often) continuous delivery, Yes, Yes, Yes, Too long, Easy, 7740, 
67771, I am a developer by profession, Employed, full-time, Hybrid (some remote, some in-person), Hobby;Bootstrapping a business;Freelance/contract work, Secondary school (e.g. American high school, German Realschule or Gymnasium, etc.), Books / Physical media;Other online resources (e.g., videos, blogs, forum);School (i.e., University, College, etc);Online Courses or Certification, Technical documentation;Blogs;Written Tutorials;Stack Overflow;Online books;Video-based Online Courses;Online forum;How-to videos, Coursera;Udemy;Udacity, 7, 4, Developer, front-end;Developer, mobile, 10 to 19 employees, I have some influence, Start a free trial;Visit developer communities like Stack Overflow;Ask developers I know/work with;Research companies that have advertised on sites I visit;Read ratings or reviews on third party sites like G2Crowd;Research companies that have emailed me, Bhutan, BTN	Bhutanese ngultrum, 330000, Monthly, Dart;JavaScript;TypeScript, Dart;Elixir;Go;Rust;TypeScript, Cloud Firestore;PostgreSQL;SQLite, MySQL;PostgreSQL;Redis;SQLite, Firebase;Google Cloud, AWS;Google Cloud;Microsoft Azure, Angular;Next.js;React.js, Phoenix, Flutter, Flutter;TensorFlow, Homebrew;npm;Yarn, Homebrew;Yarn, Android Studio;Visual Studio Code;Xcode, Visual Studio Code, macOS, macOS, Git, Command-line, , , ClickUp;Trello, Jira Work Management, Google Chat;Slack, Slack, Very unfavorable, Stack Overflow;Stack Exchange, A few times per week, Yes, Less than once per month or monthly, Yes, somewhat, 18-24 years old, Man, No, Straight / Heterosexual, Asian, None of the above, I have a concentration and/or memory disorder (e.g., ADHD, etc.), Yes, Independent contributor, 4, Agree, Neither agree nor disagree, Agree, Strongly agree, Strongly agree, Agree, Disagree, 1-2 times a week, 1-2 times a week, Never, 15-30 minutes a day, 30-60 minutes a day, Just right, DevOps function;Microservices;Developer portal or other central places to find tools/services;Continuous integration (CI) and (more often) continuous delivery;Observability tools, No, Yes, Yes, Too long, Neither easy nor difficult, 51072, 
