ResponseId,MainBranch,Employment,RemoteWork,CodingActivities,EdLevel,LearnCode,LearnCodeOnline,LearnCodeCoursesCert,YearsCode,YearsCodePro,DevType,OrgSize,PurchaseInfluence,BuyNewTool,Country,Currency,CompTotal,CompFreq,LanguageHaveWorkedWith,LanguageWantToWorkWith,DatabaseHaveWorkedWith,DatabaseWantToWorkWith,PlatformHaveWorkedWith,PlatformWantToWorkWith,WebframeHaveWorkedWith,WebframeWantToWorkWith,MiscTechHaveWorkedWith,MiscTechWantToWorkWith,ToolsTechHaveWorkedWith,ToolsTechWantToWorkWith,NEWCollabToolsHaveWorkedWith,NEWCollabToolsWantToWorkWith,OpSysProfessional use,OpSysPersonal use,VersionControlSystem,VCInteraction,VCHostingPersonal use,VCHostingProfessional use,OfficeStackAsyncHaveWorkedWith,OfficeStackAsyncWantToWorkWith,OfficeStackSyncHaveWorkedWith,OfficeStackSyncWantToWorkWith,Blockchain,NEWSOSites,SOVisitFreq,SOAccount,SOPartFreq,SOComm,Age,Gender,Trans,Sexuality,Ethnicity,Accessibility,MentalHealth,TBranch,ICorPM,WorkExp,Knowledge_1,Knowledge_2,Knowledge_3,Knowledge_4,Knowledge_5,Knowledge_6,Knowledge_7,Frequency_1,Frequency_2,Frequency_3,TimeSearching,TimeAnswering,Onboarding,ProfessionalTech,TrueFalse_1,TrueFalse_2,TrueFalse_3,SurveyLength,SurveyEase,ConvertedCompYearly
6805, I code primarily as a hobby, Employed, full-time, Fully remote, Hobby, Primary/elementary school, Other online resources (e.g., videos, blogs, forum), Technical documentation;Blogs;Auditory material (e.g., podcasts), NA, 4, NA, Other (please specify):, NA, NA, Other (please specify):, Jamaica, NA, NA, NA, Bash/Shell;C;C++;Dart;HTML/CSS;Java;JavaScript;PHP;Python;Rust, C++;JavaScript;Python;Rust, MariaDB;PostgreSQL, MariaDB;PostgreSQL, AWS, AWS, Express;Node.js, Express;Node.js, Flutter;GTK, GTK;Qt, npm;Unity 3D, npm, Android Studio;Atom;CLion;IntelliJ;Neovim;PyCharm;Visual Studio Code, CLion;IntelliJ;Neovim;PyCharm;Visual Studio Code, Linux-based, Linux-based, Git, Command-line, , , Trello, NA, Microsoft Teams, NA, Unfavorable, Stack Overflow;Stack Exchange, A few times per month or weekly, No, NA, No, not really, NA, Man, No, Straight / Heterosexual, NA, NA, NA, No, NA, NA, NA, NA, NA, NA, NA, NA, NA, NA, NA, NA, NA, NA, NA, NA, NA, NA, NA, Appropriate in length, Easy, NA, 
15379, I am not primarily a developer, but I write code sometimes as part of my work, Not employed, but looking for work, NA, NA, Associate degree (A.A., A.S., etc.), Books / Physical media;Other online resources (e.g., videos, blogs, forum);School (i.e., University, College, etc), Technical documentation;Blogs;Online books;Online challenges (e.g., daily or weekly coding challenges);How-to videos;Coding sessions (live or recorded), NA, 4, NA, Developer, front-end;Developer, back-end;Student, NA, NA, Start a free trial;Visit developer communities like Stack Overflow;Ask developers I know/work with;Read ratings or reviews on third party sites like G2Crowd, Jamaica, NA, NA, NA, HTML/CSS;JavaScript;Python;Rust;TypeScript, C;C++;Go;Kotlin;Lua;Python;Rust;TypeScript, MongoDB;SQLite, MongoDB;SQLite, Heroku;Linode, Linode, FastAPI, Deno;Django;FastAPI;Flask;Nuxt.js;Svelte;Vue.js, Electron, NA, Docker;npm;Unity 3D;Yarn, Docker, Neovim;Visual Studio Code, Neovim;Visual Studio Code, Linux-based;Windows, Linux-based;Windows, Git, Code editor;Command-line;Dedicated version control GUI application, , , NA, NA, Zoom, NA, Unfavorable, Stack Overflow, A few times per week, Yes, I have never participated in Q&A on Stack Overflow, Neutral, 18-24 years old, Man, No, Straight / Heterosexual, Black;Caribbean, None of the above, I have a concentration and/or memory disorder (e.g., ADHD, etc.), NA, NA, NA, NA, NA, NA, NA, NA, NA, NA, NA, NA, NA, NA, NA, NA, NA, NA, NA, NA, Appropriate in length, Neither easy nor difficult, NA, 
15824, I am a developer by profession, Employed, full-time;Independent contractor, freelancer, or self-employed;Employed, part-time, Hybrid (some remote, some in-person), Hobby;Freelance/contract work, Bachelor’s degree (B.A., B.S., B.Eng., etc.), School (i.e., University, College, etc), NA, NA, 19, 3, Developer, front-end;Developer, back-end;Student;Educator;Academic researcher, 500 to 999 employees, I have little or no influence, Start a free trial;Visit developer communities like Stack Overflow;Research companies that have advertised on sites I visit;Read ratings or reviews on third party sites like G2Crowd, Jamaica, JMD	Jamaican dollar, NA, Monthly, C#;HTML/CSS;JavaScript;PHP;SQL, C#;Dart;HTML/CSS;Java;JavaScript;PHP;Python;SQL;Swift, Microsoft SQL Server;MySQL, Cassandra;Couchbase;CouchDB;Cloud Firestore;Elasticsearch;Microsoft SQL Server;MongoDB;MySQL;Firebase Realtime Database;Redis;SQLite, Firebase;Google Cloud;Managed Hosting;Microsoft Azure, AWS;Firebase;Google Cloud;Heroku;Managed Hosting;Microsoft Azure;VMware, ASP.NET;Laravel;Vue.js, ASP.NET;ASP.NET Core ;Blazor;Django;Laravel;Next.js;Node.js;Vue.js, .NET;Flutter, .NET;Flutter;NumPy;React Native;TensorFlow;Torch/PyTorch, npm;Unity 3D, Docker;npm;Unity 3D, Android Studio;Visual Studio;Visual Studio Code, Android Studio;Visual Studio;Visual Studio Code;Xcode, Windows, Windows, Git, Code editor;Command-line;Version control hosting service web GUI;Dedicated version control GUI application, , , ClickUp;Trello, Asana;ClickUp;Trello, Cisco Webex Teams;Google Chat;Microsoft Teams;Zoom, Cisco Webex Teams;Google Chat;Microsoft Teams;Zoom, Favorable, Stack Overflow, Multiple times per day, Yes, I have never participated in Q&A on Stack Overflow, Yes, somewhat, 35-44 years old, Man, No, Straight / Heterosexual, Black;Caribbean, None of the above, None of the above, Yes, Independent contributor, 20, Strongly agree, Disagree, Agree, Strongly agree, Strongly agree, Agree, Disagree, 1-2 times a week, 10+ times a week, Never, 30-60 minutes a day, Less than 15 minutes a day, Just right, None of these, No, Yes, Yes, Appropriate in length, Easy, NA, 
20486, I am a developer by profession, Student, part-time, NA, NA, Primary/elementary school, Books / Physical media;Friend or family member;Other online resources (e.g., videos, blogs, forum);Online Courses or Certification, Technical documentation;Blogs;Programming Games;Written Tutorials;Stack Overflow;Online books;Video-based Online Courses;Online forum;How-to videos;Written-based Online Courses;Interactive tutorial;Coding sessions (live or recorded), NA, 6, NA, NA, NA, NA, Start a free trial;Visit developer communities like Stack Overflow;Research companies that have advertised on sites I visit;Read ratings or reviews on third party sites like G2Crowd;Research companies that have emailed me, Jamaica, NA, NA, NA, C++;HTML/CSS;JavaScript;PHP;Python;TypeScript, C++;HTML/CSS;JavaScript;Python;TypeScript, NA, NA, NA, NA, Vue.js, Vue.js, Electron;Ionic, Electron;Ionic, Yarn, Yarn, Nano;Visual Studio Code, Nano;Visual Studio Code, , Windows, Git, Code editor;Command-line;Version control hosting service web GUI;Dedicated version control GUI application, , , NA, NA, NA, NA, Unfavorable, Stack Overflow for Teams (private knowledge sharing & collaboration platform for companies);Stack Overflow;Stack Exchange, A few times per week, Yes, A few times per month or weekly, Neutral, Under 18 years old, Man, No, Straight / Heterosexual, White;European;African, None of the above, None of the above, NA, NA, NA, NA, NA, NA, NA, NA, NA, NA, NA, NA, NA, NA, NA, NA, NA, NA, NA, NA, Appropriate in length, Easy, NA, 
21547, I am a developer by profession, Student, full-time;Independent contractor, freelancer, or self-employed, Fully remote, Hobby;Bootstrapping a business;Freelance/contract work;School or academic work, Secondary school (e.g. American high school, German Realschule or Gymnasium, etc.), Books / Physical media;Other online resources (e.g., videos, blogs, forum);School (i.e., University, College, etc);Online Courses or Certification, Technical documentation;Stack Overflow;Online books;How-to videos, Other, 3, NA, Developer, full-stack, NA, NA, Start a free trial;Visit developer communities like Stack Overflow;Ask developers I know/work with, Jamaica, NA, NA, NA, C;Dart;Java;JavaScript;PHP;Python;SQL;TypeScript, Dart;Go;Java;JavaScript;Kotlin;Python;SQL;TypeScript, MongoDB;MySQL;PostgreSQL;Firebase Realtime Database, CouchDB;DynamoDB;MariaDB;MongoDB;MySQL;PostgreSQL;Firebase Realtime Database;Redis;SQLite, Google Cloud;Heroku, AWS;Firebase;Google Cloud, Angular;Express;Next.js;Node.js;React.js;Vue.js, Angular;Express;Node.js;React.js;Vue.js, Flutter;Ionic, Flutter, Docker;Homebrew;npm;Yarn, Docker;Homebrew;npm;Yarn, Android Studio;IntelliJ;Notepad++;PhpStorm;PyCharm;Visual Studio;Visual Studio Code;Webstorm;Xcode, Android Studio;IntelliJ;Visual Studio Code, Windows;Windows Subsystem for Linux (WSL), macOS, Git, Command-line, , , Asana;Confluence;Jira Work Management;Trello, Confluence;Jira Work Management;Trello, Slack;Zoom, Slack;Zoom, Indifferent, Stack Overflow;Stack Exchange, Multiple times per day, Yes, Less than once per month or monthly, Yes, somewhat, 18-24 years old, Man, No, Straight / Heterosexual, African;Black;Caribbean, None of the above, None of the above, NA, NA, NA, NA, NA, NA, NA, NA, NA, NA, NA, NA, NA, NA, NA, NA, NA, NA, NA, NA, Appropriate in length, Neither easy nor difficult, NA, 
24569, I am learning to code, Not employed, but looking for work, NA, NA, Secondary school (e.g. American high school, German Realschule or Gymnasium, etc.), Other online resources (e.g., videos, blogs, forum), Technical documentation;Blogs;Programming Games;Written Tutorials;Online books;Video-based Online Courses;Online challenges (e.g., daily or weekly coding challenges);How-to videos;Written-based Online Courses;Interactive tutorial;Coding sessions (live or recorded);Certification videos, NA, 2, NA, Student, NA, NA, Start a free trial;Ask developers I know/work with;Read ratings or reviews on third party sites like G2Crowd, Jamaica, NA, NA, NA, C++;Dart;HTML/CSS;JavaScript;Kotlin;Python;SAS, HTML/CSS;JavaScript;Python, Cloud Firestore;MongoDB;Firebase Realtime Database, Cloud Firestore;MongoDB;MySQL;Firebase Realtime Database, Firebase, AWS;Firebase;Heroku, Express;Next.js;Node.js;React.js, Django;Express;Flask;Next.js;Node.js;React.js;Svelte, Keras;NumPy;Pandas;Scikit-learn;TensorFlow, React Native, npm, npm, Sublime Text;Visual Studio;Visual Studio Code, Visual Studio Code, Windows, Windows, Git, Command-line, , , Notion, Notion;Trello, Microsoft Teams;Zoom, Microsoft Teams;Zoom, Very favorable, Stack Overflow;Stack Exchange, A few times per month or weekly, Not sure/can't remember, NA, Neutral, 18-24 years old, Man, No, Straight / Heterosexual, Caribbean, None of the above, None of the above, NA, NA, NA, NA, NA, NA, NA, NA, NA, NA, NA, NA, NA, NA, NA, NA, NA, NA, NA, NA, Appropriate in length, Easy, NA, 
26375, I code primarily as a hobby, Independent contractor, freelancer, or self-employed, Fully remote, Hobby;Freelance/contract work, Something else, Other online resources (e.g., videos, blogs, forum), Technical documentation;Stack Overflow;Video-based Online Courses;How-to videos;Interactive tutorial, NA, 1, NA, Developer, mobile, NA, NA, Start a free trial;Visit developer communities like Stack Overflow, Jamaica, NA, NA, NA, Dart;Go;HTML/CSS;Java;JavaScript;Kotlin;PHP;Python;TypeScript, C#;Dart;Go;HTML/CSS;JavaScript;Kotlin;PHP;Python;R;Ruby;Rust;SQL;TypeScript, NA, NA, Firebase, AWS;DigitalOcean;Firebase;Microsoft Azure, React.js;Vue.js, Angular;ASP.NET;ASP.NET Core ;Django;Drupal;Laravel;Node.js;Nuxt.js;Ruby on Rails;Svelte;Vue.js, Flutter;React Native, .NET;Flutter;React Native;TensorFlow, npm, npm, Android Studio;Notepad++;Visual Studio;Visual Studio Code, GoLand;IntelliJ;Visual Studio Code, Windows, Windows, Git, Command-line, , , NA, NA, NA, NA, Unfavorable, Collectives on Stack Overflow, A few times per month or weekly, Yes, I have never participated in Q&A on Stack Overflow, Yes, somewhat, 25-34 years old, Man, No, Straight / Heterosexual, Caribbean, None of the above, None of the above, NA, NA, NA, NA, NA, NA, NA, NA, NA, NA, NA, NA, NA, NA, NA, NA, NA, NA, NA, NA, Appropriate in length, Easy, NA, 
37755, I am learning to code, Student, full-time, NA, NA, Primary/elementary school, Other online resources (e.g., videos, blogs, forum);Online Courses or Certification, Written Tutorials;Stack Overflow;Online books;Video-based Online Courses;How-to videos;Written-based Online Courses;Interactive tutorial, Other, Less than 1 year, NA, NA, NA, NA, Visit developer communities like Stack Overflow;Read ratings or reviews on third party sites like G2Crowd, Jamaica, NA, NA, NA, HTML/CSS;Python, HTML/CSS;JavaScript;Python;SQL, NA, NA, NA, NA, Django, Django;React.js, NA, NA, NA, NA, PyCharm;Sublime Text;Visual Studio Code, Sublime Text;Visual Studio Code, , Windows, Git, Code editor;Command-line, , , NA, NA, Zoom, Zoom, Indifferent, Stack Overflow, Daily or almost daily, Yes, I have never participated in Q&A on Stack Overflow, Yes, somewhat, Under 18 years old, Man, No, Straight / Heterosexual, Caribbean, None of the above, I have a concentration and/or memory disorder (e.g., ADHD, etc.), NA, NA, NA, NA, NA, NA, NA, NA, NA, NA, NA, NA, NA, NA, NA, NA, NA, NA, NA, NA, Appropriate in length, Easy, NA, 
37926, I am learning to code, Not employed, but looking for work, NA, NA, Secondary school (e.g. American high school, German Realschule or Gymnasium, etc.), Books / Physical media;Other online resources (e.g., videos, blogs, forum), Programming Games;Written Tutorials;Stack Overflow;Video-based Online Courses;Online challenges (e.g., daily or weekly coding challenges);How-to videos;Written-based Online Courses;Auditory material (e.g., podcasts);Interactive tutorial;Coding sessions (live or recorded), NA, 1, NA, Student, NA, NA, Start a free trial;Visit developer communities like Stack Overflow;Research companies that have advertised on sites I visit;Read ratings or reviews on third party sites like G2Crowd, Jamaica, NA, NA, NA, HTML/CSS, C;C#;C++;Go;HTML/CSS;Java;JavaScript;PHP;Python;Ruby;SAS;SQL, NA, NA, Google Cloud, Google Cloud, NA, NA, NA, NA, NA, NA, Atom;Notepad++;Sublime Text;Vim, Atom;IPython/Jupyter;Notepad++;Sublime Text;Vim;Visual Studio;Visual Studio Code, Windows, Windows, Git, Code editor, , , monday.com, monday.com;Stack Overflow for Teams;Trello, RingCentral, RingCentral, Very favorable, Stack Overflow, A few times per week, Yes, I have never participated in Q&A on Stack Overflow, Yes, somewhat, 18-24 years old, Woman, No, Straight / Heterosexual, Caribbean, None of the above, I have an anxiety disorder;I have a concentration and/or memory disorder (e.g., ADHD, etc.), NA, NA, NA, NA, NA, NA, NA, NA, NA, NA, NA, NA, NA, NA, NA, NA, NA, NA, NA, NA, Appropriate in length, Easy, NA, 
38081, I am a developer by profession, Employed, full-time, Full in-person, Hobby, Bachelor’s degree (B.A., B.S., B.Eng., etc.), Other online resources (e.g., videos, blogs, forum);School (i.e., University, College, etc);Online Courses or Certification, Technical documentation;Blogs, Udemy, 10, 5, Developer, desktop or enterprise applications, 20 to 99 employees, I have some influence, Start a free trial;Visit developer communities like Stack Overflow;Research companies that have advertised on sites I visit;Read ratings or reviews on third party sites like G2Crowd, Jamaica, USD	United States dollar, 74500, Yearly, C#;SQL, C#;HTML/CSS;JavaScript;SQL, Microsoft SQL Server, Microsoft SQL Server, NA, NA, NA, NA, .NET, .NET;Flutter;NumPy;Pandas, NA, NA, Notepad++;Rider;Visual Studio;Visual Studio Code, Visual Studio;Visual Studio Code, Windows, macOS;Windows, Git, Dedicated version control GUI application, , , NA, NA, Cisco Webex Teams;Microsoft Teams;Zoom, Microsoft Teams, Indifferent, Stack Overflow;Stack Exchange, A few times per week, Yes, I have never participated in Q&A on Stack Overflow, Neutral, 25-34 years old, Man, No, Straight / Heterosexual, Caribbean;South American, None of the above, None of the above, Yes, Independent contributor, 5, Agree, Disagree, Neither agree nor disagree, Agree, Strongly agree, Agree, Agree, 1-2 times a week, 3-5 times a week, 1-2 times a week, 60-120 minutes a day, 60-120 minutes a day, Just right, Developer portal or other central places to find tools/services, Yes, No, Yes, Appropriate in length, Easy, 74500, 
38266, I am learning to code, Employed, full-time, Fully remote, Hobby;School or academic work, Bachelor’s degree (B.A., B.S., B.Eng., etc.), Books / Physical media;Other online resources (e.g., videos, blogs, forum);School (i.e., University, College, etc), Technical documentation;Blogs;Written Tutorials;Stack Overflow;Online books;Video-based Online Courses;Online forum;How-to videos;Coding sessions (live or recorded), NA, 7, NA, Student, NA, NA, Start a free trial;Visit developer communities like Stack Overflow;Research companies that have advertised on sites I visit;Read ratings or reviews on third party sites like G2Crowd, Jamaica, NA, NA, NA, NA, NA, NA, NA, NA, NA, NA, NA, NA, NA, NA, NA, IntelliJ;Visual Studio;Visual Studio Code, Android Studio;Webstorm, macOS, Windows, Git, Dedicated version control GUI application, , , NA, NA, Microsoft Teams, NA, Very unfavorable, Stack Overflow;Stack Exchange, Less than once per month or monthly, Yes, Less than once per month or monthly, Yes, somewhat, 18-24 years old, Man, No, Gay or Lesbian, Caribbean, None of the above, I have an anxiety disorder, No, NA, NA, NA, NA, NA, NA, NA, NA, NA, NA, NA, NA, NA, NA, NA, NA, NA, NA, NA, Appropriate in length, Easy, NA, 
39092, I am a developer by profession, Employed, full-time, Hybrid (some remote, some in-person), Hobby, Master’s degree (M.A., M.S., M.Eng., MBA, etc.), Other online resources (e.g., videos, blogs, forum);School (i.e., University, College, etc);On the job training;Online Courses or Certification;Hackathons (virtual or in-person), Technical documentation;Blogs;Written Tutorials;Stack Overflow;Video-based Online Courses;How-to videos;Coding sessions (live or recorded), Udemy, 15, 9, Developer, full-stack;Developer, back-end;Developer, mobile, 100 to 499 employees, I have some influence, Start a free trial;Visit developer communities like Stack Overflow;Ask developers I know/work with, Jamaica, JMD	Jamaican dollar, 4549705, Yearly, Dart;HTML/CSS;Java;JavaScript;Kotlin;SQL;TypeScript, Dart;Go;HTML/CSS;Java;Kotlin;Rust;SQL;TypeScript, PostgreSQL;SQLite, Elasticsearch;PostgreSQL;SQLite, Firebase;Google Cloud;Heroku, AWS;DigitalOcean;Firebase;Google Cloud;Microsoft Azure, Angular;Express;Node.js;Vue.js, Angular;Express;Node.js;Nuxt.js;Vue.js, Flutter;Spring, Flutter;Spring;TensorFlow, Docker;npm, Docker;Kubernetes;npm;Yarn, Android Studio;IntelliJ;Notepad++;Sublime Text;Visual Studio Code, Android Studio;IntelliJ;Visual Studio Code;Xcode, Windows, Windows;Windows Subsystem for Linux (WSL), Git, Code editor;Command-line;Version control hosting service web GUI;Dedicated version control GUI application, , , Asana;Trello, Notion;Stack Overflow for Teams;Trello, Microsoft Teams;Slack;Zoom, Slack;Zoom, Indifferent, Stack Overflow;Stack Exchange, Daily or almost daily, Yes, I have never participated in Q&A on Stack Overflow, Not sure, 25-34 years old, Man, No, Straight / Heterosexual, Caribbean, None of the above, None of the above, Yes, People manager, 10, Agree, Strongly agree, Neither agree nor disagree, Neither agree nor disagree, Agree, Strongly agree, Neither agree nor disagree, 1-2 times a week, 1-2 times a week, 3-5 times a week, 15-30 minutes a day, 30-60 minutes a day, Very long, DevOps function;Continuous integration (CI) and (more often) continuous delivery;Observability tools, Yes, Yes, Yes, Appropriate in length, Neither easy nor difficult, 29397, 
39848, I am a developer by profession, Independent contractor, freelancer, or self-employed, Fully remote, Hobby, Primary/elementary school, Other online resources (e.g., videos, blogs, forum);Online Courses or Certification, Technical documentation;Blogs;Stack Overflow;Video-based Online Courses;Interactive tutorial, Other, 7, Less than 1 year, Developer, full-stack;Database administrator;Project manager;Designer;Marketing or sales professional, Just me - I am a freelancer, sole proprietor, etc., I have a great deal of influence, Start a free trial;Visit developer communities like Stack Overflow;Ask developers I know/work with, Jamaica, USD	United States dollar, 15000, Monthly, HTML/CSS;JavaScript;TypeScript, HTML/CSS;Swift;TypeScript, Cloud Firestore;MongoDB;PostgreSQL, Elasticsearch;MongoDB;PostgreSQL;Redis;SQLite, Firebase, AWS;DigitalOcean, Express;jQuery;Node.js;React.js;Vue.js, Deno;Express;Fastify;Next.js;Node.js;React.js;Svelte, NA, NA, npm;Yarn, Docker;npm;Yarn, Atom;Sublime Text;Visual Studio Code, Visual Studio Code;Xcode, Windows, Windows, Git, Code editor;Command-line, , , Notion, Notion, Microsoft Teams;Zoom, Zoom, Unfavorable, Stack Overflow;Stack Exchange, A few times per month or weekly, Not sure/can't remember, NA, No, not at all, Under 18 years old, Man, No, Gay or Lesbian, African;Caribbean, None of the above, None of the above, NA, NA, NA, NA, NA, NA, NA, NA, NA, NA, NA, NA, NA, NA, NA, NA, NA, NA, NA, NA, Appropriate in length, Easy, 180000, 
44996, I am not primarily a developer, but I write code sometimes as part of my work, Employed, full-time, Full in-person, Hobby, Bachelor’s degree (B.A., B.S., B.Eng., etc.), Books / Physical media;Other online resources (e.g., videos, blogs, forum);School (i.e., University, College, etc);On the job training;Online Courses or Certification, Technical documentation;Blogs;Written Tutorials;Stack Overflow;Online books;Video-based Online Courses;Online challenges (e.g., daily or weekly coding challenges);Online forum;How-to videos;Interactive tutorial;Coding sessions (live or recorded);Certification videos, Coursera;Udemy;Codecademy;Udacity, 11, 5, Security professional, 1,000 to 4,999 employees, I have some influence, Start a free trial;Visit developer communities like Stack Overflow;Ask developers I know/work with;Research companies that have advertised on sites I visit, Jamaica, JMD	Jamaican dollar, 4000000, Yearly, C#;HTML/CSS;Java;JavaScript;PHP;SQL;VBA, Assembly;Bash/Shell;C;C++;PowerShell;Python, Microsoft SQL Server;MySQL, MariaDB;MongoDB;PostgreSQL, NA, NA, ASP.NET;ASP.NET Core ;Laravel, Angular;Angular.js;Django;Node.js;React.js;Vue.js, .NET, Flutter;Xamarin, NA, NA, Notepad++;Visual Studio;Visual Studio Code, Android Studio;IPython/Jupyter;PyCharm, Linux-based, Windows, Git, Command-line;Dedicated version control GUI application, , , NA, NA, Google Chat;Microsoft Teams;Zoom, Google Chat;Microsoft Teams;Zoom, Indifferent, Collectives on Stack Overflow;Stack Overflow;Stack Exchange, A few times per month or weekly, Yes, Less than once per month or monthly, Yes, definitely, 25-34 years old, Man, No, Straight / Heterosexual, Black;Caribbean, None of the above, None of the above, Yes, Independent contributor, 6, Agree, Agree, NA, Agree, Agree, Disagree, Neither agree nor disagree, 10+ times a week, 6-10 times a week, 6-10 times a week, 60-120 minutes a day, Less than 15 minutes a day, Somewhat short, None of these, Yes, Yes, Yes, Appropriate in length, Easy, 25845, 
50448, I code primarily as a hobby, Employed, full-time, Full in-person, Hobby, Master’s degree (M.A., M.S., M.Eng., MBA, etc.), Books / Physical media;Other online resources (e.g., videos, blogs, forum);School (i.e., University, College, etc), Technical documentation;Blogs;Programming Games;Written Tutorials;Stack Overflow;Online forum, NA, 31, NA, Other (please specify):;System administrator, NA, NA, Other (please specify):;Ask developers I know/work with;Research companies that have advertised on sites I visit;Read ratings or reviews on third party sites like G2Crowd;Research companies that have emailed me, Jamaica, NA, NA, NA, HTML/CSS;Java;JavaScript;PowerShell, HTML/CSS;Java;JavaScript;PowerShell;TypeScript, Microsoft SQL Server, Microsoft SQL Server, NA, NA, Express;Node.js, Express;Node.js, NA, NA, NA, NA, NetBeans;Notepad++;Visual Studio Code, NetBeans;Notepad++;Visual Studio Code, Windows, Windows, I don't use one, NA, , , NA, NA, Microsoft Teams;Zoom, Zoom, Favorable, Stack Overflow;Stack Exchange, A few times per month or weekly, Yes, Less than once per month or monthly, No, not really, 45-54 years old, Man, No, Straight / Heterosexual, Black;Caribbean, None of the above, None of the above, Yes, Independent contributor, 28, Agree, Neither agree nor disagree, Neither agree nor disagree, Neither agree nor disagree, Neither agree nor disagree, Disagree, Agree, 1-2 times a week, 3-5 times a week, 1-2 times a week, 15-30 minutes a day, 60-120 minutes a day, Somewhat short, None of these, Yes, No, No, Appropriate in length, Easy, NA, 
