56829, I am not primarily a developer, but I write code sometimes as part of my work, Employed, full-time;Student, full-time;Independent contractor, freelancer, or self-employed, Fully remote, Hobby;Freelance/contract work;School or academic work, Bachelor’s degree (B.A., B.S., B.Eng., etc.), Books / Physical media;Friend or family member;Other online resources (e.g., videos, blogs, forum);School (i.e., University, College, etc), Online books;How-to videos;Interactive tutorial;Coding sessions (live or recorded), NA, 6, NA, Student;Designer, NA, NA, Ask developers I know/work with;Research companies that have advertised on sites I visit, Jamaica, NA, NA, NA, HTML/CSS, HTML/CSS;Java;JavaScript;PHP;Python;SQL;TypeScript, NA, NA, NA, NA, NA, NA, NA, NA, NA, NA, NA, NA, Windows, macOS;Windows, I don't use one, NA, , , Confluence;Jira Work Management;Trello, Asana;ClickUp;Notion;Trello, Cisco Webex Teams;Slack;Zoom, Slack;Zoom, Favorable, I have never visited Stack Overflow or the Stack Exchange network, NA, No, NA, No, not at all, 25-34 years old, Woman, No, Straight / Heterosexual, Caribbean, None of the above, I have a mood or emotional disorder (e.g., depression, bipolar disorder, etc.);I have an anxiety disorder;I have a concentration and/or memory disorder (e.g., ADHD, etc.), Yes, Independent contributor, 11, Agree, Agree, Agree, Agree, Disagree, Agree, Agree, 6-10 times a week, 6-10 times a week, 10+ times a week, 60-120 minutes a day, 60-120 minutes a day, Somewhat short, None of these, No, Yes, Yes, Appropriate in length, Neither easy nor difficult, NA, 
59243, I code primarily as a hobby, Student, full-time;Not employed, but looking for work, NA, NA, Secondary school (e.g. American high school, German Realschule or Gymnasium, etc.), Other online resources (e.g., videos, blogs, forum);School (i.e., University, College, etc), Technical documentation;Written Tutorials;Stack Overflow;How-to videos, NA, 4, NA, Student, NA, NA, Other (please specify):, Jamaica, NA, NA, NA, C#;C++;HTML/CSS;Java;Python;SQL;TypeScript, C#;HTML/CSS;Rust;TypeScript, MongoDB;MySQL;PostgreSQL;SQLite, SQLite, NA, NA, Express;Node.js;React.js, Deno;Express;Node.js;React.js;Svelte;Vue.js, .NET, .NET, npm, npm, Visual Studio;Visual Studio Code, Visual Studio;Visual Studio Code, Windows, Windows, Git, Code editor;Command-line;Version control hosting service web GUI, , , NA, NA, Zoom, NA, Unsure, Stack Overflow;Stack Exchange, Daily or almost daily, No, NA, No, not at all, 18-24 years old, Man, No, Straight / Heterosexual, Black;Caribbean, I am blind / have difficulty seeing, None of the above, NA, NA, NA, NA, NA, NA, NA, NA, NA, NA, NA, NA, NA, NA, NA, NA, NA, NA, NA, NA, Too long, Easy, NA, 
61099, I am a developer by profession, Employed, full-time, Hybrid (some remote, some in-person), Hobby;School or academic work, Master’s degree (M.A., M.S., M.Eng., MBA, etc.), Books / Physical media;Friend or family member;Other online resources (e.g., videos, blogs, forum);School (i.e., University, College, etc);On the job training;Online Courses or Certification;Colleague, Technical documentation;Blogs;Written Tutorials;Stack Overflow;Online books;Video-based Online Courses;How-to videos;Auditory material (e.g., podcasts);Interactive tutorial;Coding sessions (live or recorded), Udemy;Codecademy;Pluralsight, 22, 14, Developer, full-stack, 500 to 999 employees, I have some influence, Start a free trial, Jamaica, JMD	Jamaican dollar, 4000000, Yearly, HTML/CSS;JavaScript;PHP;Python;SQL;TypeScript, HTML/CSS;JavaScript;PHP;Python;Ruby;SQL;TypeScript, Microsoft SQL Server;MySQL;Oracle;PostgreSQL, Microsoft SQL Server;MongoDB;MySQL;Oracle;PostgreSQL, DigitalOcean;Heroku, AWS;DigitalOcean, Angular;Drupal;Express;Flask;jQuery;Laravel;Node.js;Vue.js, Angular;Deno;Drupal;FastAPI;Flask;Laravel;Node.js;Nuxt.js;React.js;Svelte;Vue.js, Ionic, Flutter;Ionic, Docker;Homebrew;npm;Yarn, Docker;Homebrew;npm, PhpStorm;PyCharm;Vim;Visual Studio Code, PhpStorm;Vim;Visual Studio Code, Linux-based;macOS;Windows, Linux-based;macOS, Git, Code editor;Command-line;Version control hosting service web GUI, , , Airtable;Notion, Notion, Slack;Zoom, Slack;Zoom, Favorable, Stack Overflow;Stack Exchange, A few times per month or weekly, No, NA, No, not really, 35-44 years old, Man, No, Straight / Heterosexual, Caribbean, None of the above, None of the above, Yes, Independent contributor, 22, Agree, Agree, Neither agree nor disagree, Agree, Agree, Strongly agree, Neither agree nor disagree, 1-2 times a week, 1-2 times a week, 1-2 times a week, 15-30 minutes a day, 30-60 minutes a day, Somewhat long, None of these, Yes, No, Yes, Appropriate in length, Easy, 25845, 
66174, I am a developer by profession, Employed, full-time, Full in-person, Bootstrapping a business;Freelance/contract work, Bachelor’s degree (B.A., B.S., B.Eng., etc.), School (i.e., University, College, etc), NA, NA, 13, 8, Developer, full-stack;Developer, mobile, 10 to 19 employees, I have a great deal of influence, Start a free trial;Visit developer communities like Stack Overflow;Ask developers I know/work with, Jamaica, JMD	Jamaican dollar, 2000000, Yearly, C#;Dart;HTML/CSS;JavaScript;Kotlin;Python;SQL;Swift, C#;Dart;Go;Java;Python;Rust;Solidity, Cloud Firestore;Microsoft SQL Server;Firebase Realtime Database, Microsoft SQL Server, Microsoft Azure, AWS, ASP.NET Core , ASP.NET Core , .NET;Flutter, .NET;Flutter, Homebrew;Unity 3D, Homebrew, Android Studio;Neovim;Vim;Visual Studio;Visual Studio Code;Xcode, Android Studio;Neovim;Visual Studio Code, Linux-based;macOS;Windows, Linux-based;macOS;Windows, Git, Code editor;Command-line, , , ClickUp, NA, Microsoft Teams;Zoom, Microsoft Teams, Very favorable, Stack Overflow;Stack Exchange, Multiple times per day, Yes, Less than once per month or monthly, Yes, definitely, 25-34 years old, Man, No, Straight / Heterosexual, Black;Hispanic or Latino/a, None of the above, None of the above, Yes, Independent contributor, 8, Agree, Strongly disagree, Agree, Strongly agree, Strongly agree, Agree, Strongly agree, 1-2 times a week, 1-2 times a week, Never, Over 120 minutes a day, 15-30 minutes a day, Very long, Microservices;Developer portal or other central places to find tools/services, No, No, No, Appropriate in length, Easy, 12923, 
68267, I am not primarily a developer, but I write code sometimes as part of my work, Employed, full-time, Hybrid (some remote, some in-person), Hobby;Freelance/contract work, Some college/university study without earning a degree, Books / Physical media, NA, NA, 28, 2, Developer, front-end;Developer, full-stack;Developer, QA or test;Project manager;Data or business analyst;System administrator, 100 to 499 employees, I have some influence, Start a free trial, Jamaica, JMD	Jamaican dollar, NA, Monthly, C;C#;HTML/CSS;Java;JavaScript;PowerShell;Python;Ruby;SQL;TypeScript, Assembly;C;C#;C++;Clojure;COBOL;Erlang;F#;HTML/CSS;JavaScript;LISP;Lua;PowerShell;SQL, Elasticsearch;Microsoft SQL Server;MongoDB;Oracle;SQLite, Elasticsearch;Microsoft SQL Server;MongoDB;Oracle;Redis;SQLite, Microsoft Azure, NA, Angular;Angular.js;ASP.NET;ASP.NET Core ;Node.js;React.js, ASP.NET;Blazor, NA, NA, npm;Yarn, NA, Rider;Vim;Visual Studio;Webstorm, Neovim;Rider;Vim, Windows, BSD;Windows, Git;SVN, Code editor;Command-line;Version control hosting service web GUI;Dedicated version control GUI application, , , Confluence;Trello, Confluence, Google Chat;Microsoft Teams;Slack;Zoom, NA, Very favorable, Stack Overflow;Stack Exchange, A few times per week, No, NA, No, not at all, 35-44 years old, Non-binary, genderqueer, or gender non-conforming, Prefer not to say, Bisexual, Caribbean, None of the above, I have a mood or emotional disorder (e.g., depression, bipolar disorder, etc.);I have an anxiety disorder;I have a concentration and/or memory disorder (e.g., ADHD, etc.), Yes, Independent contributor, 12, Agree, Disagree, Agree, Neither agree nor disagree, Agree, Agree, Strongly agree, Never, 1-2 times a week, Never, 30-60 minutes a day, 60-120 minutes a day, Just right, DevOps function;Developer portal or other central places to find tools/services;Continuous integration (CI) and (more often) continuous delivery;Observability tools, Yes, No, No, Appropriate in length, Neither easy nor difficult, NA, 
71143, I am a developer by profession, Employed, full-time, Full in-person, Hobby, Secondary school (e.g. American high school, German Realschule or Gymnasium, etc.), Other online resources (e.g., videos, blogs, forum), Technical documentation;Blogs;Programming Games;Written Tutorials;Stack Overflow;Online books;Online challenges (e.g., daily or weekly coding challenges);Online forum;How-to videos;Written-based Online Courses;Auditory material (e.g., podcasts);Interactive tutorial;Coding sessions (live or recorded);Certification videos, NA, 6, 2, Developer, full-stack, 20 to 99 employees, I have little or no influence, Start a free trial;Research companies that have advertised on sites I visit;Read ratings or reviews on third party sites like G2Crowd, Jamaica, EUR European Euro, 8, Monthly, Dart;HTML/CSS;JavaScript;PHP;SQL;TypeScript, C#;Go;Java, MySQL, DynamoDB;MongoDB, OVH;VMware, Firebase, jQuery;React.js, Angular;Next.js, NA, NA, npm, Kubernetes;Puppet, Android Studio;Atom;Sublime Text;Visual Studio;Xcode, NA, macOS;Windows, Linux-based, Git, Code editor;Command-line, , , Trello, Notion, NA, NA, Indifferent, Stack Overflow, Daily or almost daily, Yes, Less than once per month or monthly, Neutral, 18-24 years old, Man, No, Straight / Heterosexual, White, None of the above, I have a mood or emotional disorder (e.g., depression, bipolar disorder, etc.), No, NA, NA, NA, NA, NA, NA, NA, NA, NA, NA, NA, NA, NA, NA, NA, NA, NA, NA, NA, Appropriate in length, Easy, 108, 
72078, I am learning to code, Employed, full-time;Student, part-time, Full in-person, School or academic work, Bachelor’s degree (B.A., B.S., B.Eng., etc.), Other online resources (e.g., videos, blogs, forum);School (i.e., University, College, etc), Technical documentation;Stack Overflow;How-to videos;Coding sessions (live or recorded), NA, 15, NA, Student;System administrator, NA, NA, Start a free trial, Jamaica, NA, NA, NA, C;C#;C++;HTML/CSS;Java;JavaScript;PHP;SQL, HTML/CSS;Java;JavaScript;Kotlin;Perl;PHP;Python;Ruby;Swift, Microsoft SQL Server;MySQL;Oracle, MySQL;Oracle, Google Cloud, AWS;Microsoft Azure;Oracle Cloud Infrastructure;VMware, ASP.NET;jQuery, Angular;Angular.js;jQuery;Node.js;React.js;Ruby on Rails, .NET;Cordova;Hadoop;Spring, NA, npm, NA, Android Studio;NetBeans;Visual Studio;Visual Studio Code, Android Studio;IntelliJ;NetBeans, BSD;Linux-based;macOS;Windows, Linux-based;Windows, I don't use one, NA, , , NA, NA, Cisco Webex Teams;Microsoft Teams;Slack;Zoom, Cisco Webex Teams;Microsoft Teams;Zoom, Unsure, Stack Overflow;Stack Exchange, A few times per month or weekly, No, NA, Neutral, 25-34 years old, Man, No, Straight / Heterosexual, African;Black;Caribbean, None of the above, None of the above, No, NA, NA, NA, NA, NA, NA, NA, NA, NA, NA, NA, NA, NA, NA, NA, NA, NA, NA, NA, Appropriate in length, Neither easy nor difficult, NA, 
